{
  "event": "QS.Published",
  "ts": "2025-09-02T00:00:00Z",
  "program": "BWB-Q100",
  "domain": "AAA",
  "level": "CI",
  "entity": "53-30-TIES",
  "qs_type": "VQE",
  "utcs_mi_id": "Est√°ndarUniversal:EstadoCuantico-VQE-02.00-AAA-CI-53-30-TIES-0003-v1.0-AmpelTreintaSesentaHidrogenoBlendedWingBodyQ100-AIR-AMPEL360-CAE-Materials-7b821d44-RestoDeVidaUtil",
  "det_ref": "DET:QS:AAA:CI:53-30-TIES:V1.0",
  "signature": "PQC-Dilithium3"
}